"Classes";"21/04/2018";"25/04/2018";"3";"";"text";"Which of these two class do you like more?";"Java Technologies";"Object-oriented programming";"100.0";"0.0";"text";"Which of these two is more boring, in your opinion?";"Data storage technologies";"Artificial Intelligence";"100.0";"0.0";"text";"Which of these subjects will be more worthy to learn?";"Web programming";"Artificial Intelligence";"0.0";"100.0"
"Presidents";"25/04/2018";"21/06/2018";"1";"";"text";"If you were american, who would you vote?";"Hillary Clinton";"Donald Trump";"0.0";"0.0"
"Universities";"18/04/2018";"22/04/2018";"1";"a:a:test@test.com:";"text";"Which university in Vilnius do you study in?";"Vilniaus University";"Vilniaus Gedomino Technikos Universitat";"33.0";"66.0"
"Fast foods";"30/04/2018";"01/07/2018";"1";"";"text";"Which one do you prefer?";"Hesburger";"McDonald's";"0.0";"0.0"
"Easter egg";"21/04/2018";"25/04/2018";"1";"johny@johny.com:";"text";"Who's the king? (vote for me pls :D :D )";"Fero";"Anil";"100.0";"0.0"
"Our project";"21/03/2018";"30/04/2018";"1";"";"text";"Do you really think we can make it on time?";"Yes";"No";"100.0";"0.0"
